{
  "$schema": "./schemas/catalogue.schema.json",
  "description": "The Plugin API catalogue of Plugin API Level 2: every Host Service under one namespace.verb ID used at every entry point, with its input and result, Capability, System Permission, failure categories, where it is offered and the Level 1 names it replaces; the builders, values, globals, answer members, View Events and Capabilities; and the areas Spinnet does not offer. The Host's table of operations is held to it. Level 2 promoted Candidate Contracts namespaces r1, host_operations r2 and collections r3, whose catalogue this was (candidates/namespaces/r1/catalogue.json).",
  "level": 2,
  "entry_points": {
    "call": "A script calls the operation inside its invocation: spinnet.<id>(input), or requestHostService(\"<id>\", input). Returns the result.",
    "command": "A manifest Command with execution host names it in host_command; its input is the Action's configured input and the Command's fixed input. No helper starts.",
    "view_action": "A page action or item action names it in perform with its input; the Host performs it on the user's click or key without a View Event.",
    "request": "An answer to a gesture names it in operation: {perform, input}; the Host performs it after the answer commits (ADR 0018).",
    "answer": "A member of the answer itself is this operation: toast, close.",
    "source": "The Host performs it for a visible Level 2 page source (reference/sources.md), or a Level 1 Host-Fetched Section."
  },
  "namespaces": [
    {
      "name": "ui",
      "holds": "builders",
      "summary": "Pure builders for views, pages, components and answers; requests nothing"
    },
    {
      "name": "host",
      "holds": "operations",
      "summary": "Spinnet's own UI and flow, which the Plugin asks the Host to act on: a toast, closing the Plugin View, opening the Plugin's settings; later a Plugin-worded question and launching another Command"
    },
    {
      "name": "selection",
      "holds": "operations",
      "summary": "The focused App's selection: reading, replacing, copying, cutting and pasting it; every operation targets the focused App"
    },
    {
      "name": "keyboard",
      "holds": "operations",
      "summary": "Keys pressed in the focused App; text is typed by selection.replace"
    },
    {
      "name": "clipboard",
      "holds": "operations",
      "summary": "The current clipboard's content; no operation here targets an App"
    },
    {
      "name": "clipboardHistory",
      "holds": "operations",
      "summary": "The Clipboard History Store: its own Capability (read_clipboard_history) and its own Sensitive Data Collection setting"
    },
    {
      "name": "open",
      "holds": "operations",
      "summary": "Handing a link, path or application to the App that opens it"
    },
    {
      "name": "apps",
      "holds": "operations",
      "summary": "External App integration through Reviewed App Interfaces and Deep Link Templates, and the App in front: identifying it by an App Target, and closing its window or quitting it as its own \u2318W and \u2318Q do, or force quitting it (#83)"
    },
    {
      "name": "system",
      "holds": "operations",
      "summary": "macOS facilities no single App owns: Shortcuts and Services; later keep-awake (#84) and basic metrics (#86)"
    },
    {
      "name": "window",
      "holds": "operations",
      "summary": "The focused window"
    },
    {
      "name": "screen",
      "holds": "operations",
      "summary": "Screen captures the Plugin never receives"
    },
    {
      "name": "http",
      "holds": "operations",
      "summary": "HTTPS requests with Credential Uses, from a script or as a Host-Fetched Section"
    },
    {
      "name": "text",
      "holds": "operations",
      "summary": "Text processing on this Mac"
    },
    {
      "name": "storage",
      "holds": "operations",
      "summary": "Plugin Storage"
    },
    {
      "name": "environment",
      "holds": "values",
      "summary": "The Host and the invocation the script runs under"
    },
    {
      "name": "activities",
      "holds": "operations",
      "summary": "Host-owned effects, visible and stoppable by their Plugin only; Host Status Item controls every owner"
    },
    {
      "name": "tools",
      "holds": "reserved",
      "summary": "Reviewed tool profiles such as Homebrew (#87, #88)"
    }
  ],
  "operations": [
    {
      "id": "host.toast",
      "namespace": "host",
      "summary": "Shows a short message: inside the Plugin View when one is open, otherwise near the pointer. With close it is a HUD: the view closes and the toast shows near the pointer (decision N2).",
      "status": "level1",
      "input": "schemas/namespaces.schema.json#/$defs/host.toast.input",
      "result": "schemas/namespaces.schema.json#/$defs/host.toast.result",
      "primary_member": "text",
      "capabilities": [],
      "system_permission": null,
      "failures": [
        "host_service_failed"
      ],
      "targets": null,
      "entry_points": {
        "call": {
          "status": "not_offered",
          "reason": "A toast commits with the answer that explains it; a message shown during the invocation would appear before that answer is accepted (ADR 0018)"
        },
        "command": {
          "status": "level1",
          "note": "Level 1's feedback.present drew the Host feedback panel; the catalogue form shows the toast near the pointer, as an answer's toast does without a view (decision N2)"
        },
        "view_action": {
          "status": "not_offered",
          "reason": "A button whose only effect is a message has no workload; an event action's answer carries a toast"
        },
        "request": {
          "status": "not_offered",
          "reason": "The answer's own toast member is this operation; requesting it would spend the answer's one operation"
        },
        "answer": {
          "status": "level1",
          "note": "The answer's toast member, built by ui.toast or the toast option of ui.show and ui.close; a toast with close is the HUD (decision N2)"
        }
      },
      "level1": [
        {
          "kind": "host_command",
          "name": "feedback.present"
        },
        {
          "kind": "answer_member",
          "name": "toast"
        }
      ]
    },
    {
      "id": "host.closeView",
      "namespace": "host",
      "summary": "Closes the Plugin's View and ends its View Session.",
      "status": "level1",
      "input": "schemas/namespaces.schema.json#/$defs/host.closeView.input",
      "result": "schemas/namespaces.schema.json#/$defs/host.closeView.result",
      "primary_member": null,
      "capabilities": [],
      "system_permission": null,
      "failures": [
        "host_service_failed"
      ],
      "targets": null,
      "entry_points": {
        "call": {
          "status": "not_offered",
          "reason": "Closing during an invocation would end the session before its answer"
        },
        "command": {
          "status": "not_offered",
          "reason": "A Command that runs no script has no view of its own to close"
        },
        "view_action": {
          "status": "not_offered",
          "reason": "Escape and the view's close button close any view; an action that should also close sets closes_view"
        },
        "request": {
          "status": "not_offered",
          "reason": "A request closes the view with its own closes_view; the answer closes it with close"
        },
        "answer": {
          "status": "level1",
          "note": "The answer's close member, built by ui.close"
        }
      },
      "level1": [
        {
          "kind": "answer_member",
          "name": "close"
        }
      ]
    },
    {
      "id": "host.showPluginSettings",
      "namespace": "host",
      "summary": "Opens the Plugin's own Plugin Settings sheet.",
      "status": "level1",
      "input": "schemas/namespaces.schema.json#/$defs/host.showPluginSettings.input",
      "result": "schemas/namespaces.schema.json#/$defs/host.showPluginSettings.result",
      "primary_member": null,
      "capabilities": [],
      "system_permission": null,
      "failures": [
        "host_service_failed"
      ],
      "targets": null,
      "default_title": "Plugin Settings",
      "closes_view": false,
      "entry_points": {
        "call": {
          "status": "not_offered",
          "reason": "Opening a Host window is a transition that follows the user's gesture, not a step inside an invocation"
        },
        "command": {
          "status": "level2",
          "note": "A Menu Item can open its Plugin's settings without a script (decision N10)"
        },
        "view_action": {
          "status": "level1"
        },
        "request": {
          "status": "level2",
          "note": "An answer can open the sheet after a gesture, such as one that found a missing key"
        }
      },
      "level1": [
        {
          "kind": "standard_action",
          "name": "open_plugin_settings"
        }
      ]
    },
    {
      "id": "host.confirm",
      "namespace": "host",
      "summary": "Asks the user a Plugin-worded question in the view and reports the answer as the operation's outcome; unlike a Host Confirmation it authorizes nothing.",
      "status": "reserved",
      "owner": "#68 local dialogs (accepted future direction)",
      "input": null,
      "result": null,
      "primary_member": null,
      "capabilities": [],
      "system_permission": null,
      "failures": [
        "host_service_failed"
      ],
      "targets": null,
      "entry_points": {
        "call": {
          "status": "not_offered",
          "reason": "A question waits for the user, which a four-second invocation cannot"
        },
        "command": {
          "status": "not_offered",
          "reason": "It asks inside a view"
        },
        "view_action": {